index,sentence1,sentence2,label
0,I stuck a pin through a carrot. When I pulled the pin out it had a hole.,The carrot had a hole.,1
1,ENTITYNAME0 couldn't see the stage with Billy in front of him because he is so short.,ENTITYNAME0 is so short.,1
2,The police arrested all of the gang members. They were trying to stop the drug trade in the neighborhood.,The police were trying to stop the drug trade in the neighborhood.,1
3,ENTITYNAME1 follows Fred's example in everything. He influences him hugely.,ENTITYNAME1 influences him hugely.,0
4,When Tatyana reached the cabin her mother was sleeping. She was careful not to disturb her undressing and climbing back into her berth.,mother was careful not to disturb her undressing and climbing back into her berth.,0
5,ENTITYNAME2 got free tickets to the play but he gave them to Eric because he was particularly eager to see it.,ENTITYNAME2 was particularly eager to see it.,0
6,ENTITYNAME0 was jogging through the park when he saw a man juggling watermelons. He was very impressive.,ENTITYNAME0 was very impressive.,0
7,I couldn't put the pot on the shelf because it was too tall.,The pot was too tall.,1
8,We had hoped to place copies of our newsletter on all the chairs in the auditorium but there were simply not enough of them.,There were simply not enough copies of the newsletter.,1
9,At the Loebner competition the judges couldn't figure out which respondents were the chatbots because they were so advanced.,The judges were so advanced.,0
10,I took the water bottle out of the backpack so that it would be lighter.,I took the water bottle out of the backpack so that the backpack would be lighter.,1
11,The table won't fit through the doorway because it is too narrow.,The table is too narrow.,0
12,I took the water bottle out of the backpack so that it would be handy.,I took the water bottle out of the backpack so that the backpack would be handy.,0
13,The firemen arrived after the police because they were coming from so far away.,The police were coming from so far away.,0
14,Always before ENTITYNAME3 had helped Dad with his work. But he could not help him now for Dad said that his boss at the railroad company would not want anyone but him to work in the office.,Dad could not help him now.,0
15,I poured water from the bottle into the cup until it was empty.,The cup was empty.,0
16,I put the cake away in the refrigerator. It has a lot of butter in it.,The cake has a lot of butter in it.,1
17,ENTITYNAME4 is holding captive a scientist Dr. ENTITYNAME5 who has invented a device that turns animals invisible; ENTITYNAME4 plans to use it on Geoffrey and send him to steal nuclear material from an army vault.,ENTITYNAME4 plans to use it on ENTITYNAME6 and send ENTITYNAME4 to steal nuclear material from an army vault.,0
18,The foxes are getting in at night and attacking the chickens. They have gotten very bold.,The foxes have gotten very bold.,1
19,ENTITYNAME7 pulled up a chair to the piano but it was broken so he had to stand instead.,The piano was broken so he had to stand instead.,0
20,ENTITYNAME8 knocked on Susan's door but she did not get an answer.,ENTITYNAME9 did not get an answer.,0
21,ENTITYNAME10 was playing cards with ENTITYNAME11 and was way ahead. If ENTITYNAME11 hadn't had a sudden run of good luck he would have won.,ENTITYNAME11 would have won.,0
22,I put the butterfly wing on the table and it broke.,The table broke.,0
23,ENTITYNAME12 tried to call George on the phone but he wasn't successful.,ENTITYNAME12 wasn't successful.,1
24,Look! There is a shark swimming right below that duck! It had better get away to safety fast!,The shark had better get away to safety fast!,0
25,The trophy doesn't fit into the brown suitcase because it is too large.,The suitcase is too large.,0
26,ENTITYNAME13's uncle can still beat him at tennis even though he is 30 years older.,ENTITYNAME13 is 30 years older.,0
27,The large ball crashed right through the table because it was made of steel.,The large ball was made of steel.,1
28,ENTITYNAME7 broke both his ankles and he's walking with crutches. But a month or so from now they should be better.,The crutches should be better.,0
29,ENTITYNAME14 worked hard to harvest his beans so he and his family would have enough to eat that winter His friend ENTITYNAME15 let him stack them in his barn where they would dry. Later he and ENTITYNAME16 would shell them and cook them for their Sunday dinners.,His friend ENTITYNAME15 let him stack Grant and his family in his barn where they would dry.,0
30,ENTITYNAME8 knocked on the door and Susan answered it. She invited her to come out.,ENTITYNAME8 invited her to come out.,1
31,ENTITYNAME17 had to stop Bill from toying with the injured bird. He is very cruel.,ENTITYNAME18 is very cruel.,1
32,ENTITYNAME19 said "Check" to Ralph as he took his bishop.,ENTITYNAME19 said "Check" to ENTITYNAME20 as he took ENTITYNAME20's bishop.,1
33,I sallied out for a bit of food more to pass the time than because I wanted it.,I sallied out for a bit of food more to pass the time than because I wanted food.,1
34,ENTITYNAME13 paid the detective after he received the final report on the case.,ENTITYNAME13 received the final report on the case.,1
35,We had hoped to place copies of our newsletter on all the chairs in the auditorium but there were simply too many of them.,There were simply too many copies of the newsletter.,0
36,ENTITYNAME13 has sold his house and bought a new one a few miles away. He will be moving into it on Thursday.,He will be moving into The new house on Thursday.,1
37,Always before ENTITYNAME3 had helped Dad with his work. But he could not help him now for Dad said that his boss at the railroad company would not want anyone but him to work in the office.,He could not help Dad now.,1
38,The table was piled high with food and on the floor beside it there were crocks baskets and a five-quart pail of milk.,Beside the table there were crocks baskets and a five-quart pail of milk.,1
39,ENTITYNAME21 comforted Kevin because he was so upset.,ENTITYNAME22 was so upset.,1
40,ENTITYNAME23 was greatly influenced by Arnold though he lived two centuries earlier.,ENTITYNAME24 lived two centuries earlier.,1
41,There is a pillar between me and the stage and I can't see around it.,I can't see around the stage.,0
42,Archaeologists have concluded that humans lived in Laputa 20000 years ago. They hunted for deer on the river banks.,Prehistoric humans hunted for deer on the river banks.,1
43,ENTITYNAME7 and ENTITYNAME25 are passionately in love but ENTITYNAME25's parents are unhappy about it because they are snobs.,ENTITYNAME25's parents are snobs.,1
44,ENTITYNAME18 passed the half-empty plate to John because he was hungry.,ENTITYNAME0 was hungry.,1
45,ENTITYNAME26 borrowed the book from the library because she needs it for an article she is working on. She writes it when she gets home from work.,She writes the book when she gets home from work.,0
46,ENTITYNAME0 promised Bill to leave so an hour later he left.,ENTITYNAME18 left.,0
47,ENTITYNAME26 borrowed the book from the library because she needs it for an article she is working on. She reads it when she gets home from work.,She reads the article when she gets home from work.,0
48,ENTITYNAME27 heard Steve's feet going down the ladder. The door of the shop closed after him. He ran to look out the window.,The door of the shop closed after ENTITYNAME1.,1
49,ENTITYNAME28 is the only man alive who still remembers my father as an infant. When ENTITYNAME28 first saw my father he was twelve years old.,When ENTITYNAME28 first saw my father My father was twelve years old.,0
50,Tatyana knew that Grandma always enjoyed serving an abundance of food to her guests. Now Tatyana watched as Grandma gathered Tatyana's small mother into a wide scrawny embrace and then propelled her to the table lifting her shawl from her shoulders seating her in the place of honor and saying simply: "There's plenty.",Grandma gathered Tatyana's small mother into a wide scrawny embrace and then propelled Grandma to the table.,0
51,ENTITYNAME28 watched TV while George went out to buy groceries. After an hour he got back.,ENTITYNAME2 got back.,1
52,ENTITYNAME29 spoke to Donna breaking her concentration.,ENTITYNAME29 spoke to ENTITYNAME30 breaking ENTITYNAME30's concentration.,1
53,Although they ran at about the same speed ENTITYNAME31 beat Sally because she had such a bad start.,ENTITYNAME31 had such a bad start.,0
54,ENTITYNAME32 fired her trainer because she couldn't stand her boyfriend.,She couldn't stand ENTITYNAME32's boyfriend.,0
55,I can't cut that tree down with that axe; it is too small.,The axe is too small.,1
56,ENTITYNAME32 fired her trainer because she slept with her boyfriend.,She slept with ENTITYNAME32's boyfriend.,1
57,I saw ENTITYNAME21 yelling at some guy in a military uniform with a huge red beard. I don't know why he was but he looked very unhappy.,I don't know why the guy in uniform was but he looked very unhappy.,0
58,ENTITYNAME33 tried frantically to stop her daughter from chatting at the party leaving us to wonder why she was behaving so strangely.,ENTITYNAME33's daughter was behaving so strangely.,0
59,ENTITYNAME8 knocked on Susan's door but she did not answer.,ENTITYNAME8 did not answer.,0
60,The politicians far away in Washington could not know the settlers so they must make rules to regulate them.,The politicians must make rules to regulate them.,1
61,A number of times ENTITYNAME15 had been present at interviews which his father had had with noted detectives who desired his aid in solving perplexing mysteries and those occasions stood out as red-letter days for him.,Those occasions stood out as red-letter days for ENTITYNAME15.,1
62,ENTITYNAME7 pulled up a chair to the piano but it was broken so he had to stand instead.,The chair was broken so he had to stand instead.,1
63,Since it was raining I carried the newspaper over my backpack to keep it dry.,I carried the newspaper over my backpack to keep the backpack dry.,1
64,The politicians far away in Washington could not know the settlers so they must make rules to regulate them.,They must make rules to regular the politicians.,0
65,ENTITYNAME34 did a lot better than her good friend Lucy on the test because she had studied so hard.,ENTITYNAME34 had studied so hard.,1
66,ENTITYNAME27 was close to Mr. Singer's heels. He heard him calling for the captain promising him in the jargon everyone talked that night that not one thing should be damaged on the ship except only the ammunition but the captain and all his crew had best stay in the cabin until the work was over.,Mr. ENTITYNAME35 heard him calling for the captain,0
67,ENTITYNAME28 is the only man still alive who remembers my great-grandfather. He was a remarkable man.,My great-grandfather was a remarkable man.,1
68,I couldn't put the pot on the shelf because it was too high.,The shelf was too high.,1
69,No one joins Facebook to be sad and lonely. But a new study from the University of Wisconsin psychologist ENTITYNAME36 argues that that's exactly how it makes us feel.,That's exactly how the study makes us feel.,0
70,ENTITYNAME10 paid for Charlie's college education. He is very generous.,ENTITYNAME10 is very generous.,1
71,ENTITYNAME0 promised Bill to leave so an hour later he left.,ENTITYNAME0 left.,1
72,ENTITYNAME37 was upset with Tom because the toaster he had sold him didn't work.,The toaster ENTITYNAME37 had sold him didn't work.,0
73,Equally swoon-worthy is C.K. Dexter Haven a pallid young dandy holding a jade-handled walking stick with a poodle asleep at his feet.,Equally swoon-worthy is C.K. Dexter Haven a pallid young dandy holding a jade-handled walking stick with a poodle asleep at Haven's feet.,1
74,ENTITYNAME13 has sold his house and bought a new one a few miles away. He will be moving out of it on Thursday.,He will be moving out of The old house on Thursday.,1
75,ENTITYNAME27 heard Steve's feet going down the ladder. The door of the shop closed after him. He ran to look out the window.,The door of the shop closed after ENTITYNAME27.,0
76,It is not easy to space buttonholes exactly the same distance apart and it is very difficult to cut them precisely the right size. The tiniest slip of the scissors will make the hole too large and even one thread uncut will leave it too small.,Even one thread uncut will leave the right size too small.,0
77,ENTITYNAME40 cried because Toby wouldn't accept his toy.,ENTITYNAME40 cried because ENTITYNAME41 wouldn't accept ENTITYNAME41's toy.,0
78,As ENTITYNAME42 carried Tommy up the long winding steps his legs dangled.,ENTITYNAME42's legs dangled.,0
79,ENTITYNAME7 pulled up a chair to the piano but it was broken so he had to sing instead.,The chair was broken so he had to sing instead.,0
80,The fish ate the worm. It was hungry.,The worm was hungry.,0
81,The journalists interviewed the stars of the new movie. They were very cooperative so the interview lasted for a long time.,The journalists were very cooperative so the interview lasted for a long time.,0
82,The trophy doesn't fit into the brown suitcase because it is too small.,The trophy is too small.,0
83,ENTITYNAME43 visited Cooper's grave in 1765. At that date he had been travelling for five years.,ENTITYNAME44 had been travelling for five years.,0
84,ENTITYNAME33 was dusting the living room and trying to find the button that Mama had hidden. No time today to look at old pictures in her favorite photo album. Today she had to hunt for a button so she put the album on a chair without even opening it.,She put the album on a chair without even opening the living room.,0
85,ENTITYNAME18 passed the half-empty plate to John because he was full.,Bill was full.,1
86,ENTITYNAME18 passed the half-empty plate to John because he was full.,ENTITYNAME0 was full.,0
87,The foxes are getting in at night and attacking the chickens. I shall have to kill them.,I shall have to kill The foxes.,1
88,ENTITYNAME13's uncle can still beat him at tennis even though he is 30 years younger.,ENTITYNAME13 is 30 years younger.,1
89,ENTITYNAME45 did not pass the ball to ENTITYNAME46 although she was open.,She saw that ENTITYNAME46 was open.,1
90,ENTITYNAME18 passed the gameboy to John because his turn was over.,ENTITYNAME18's turn was over.,1
91,ENTITYNAME47 asked Mary what time the library closes because she had forgotten.,Ann had forgotten.,1
92,ENTITYNAME48's parents came home and found her having sex with her boyfriend Paul. They were furious about it.,ENTITYNAME48's parents were furious about it.,1
93,This morning ENTITYNAME49 built a sand castle on the beach and put a toy flag in the highest tower but this afternoon the tide knocked it down.,This afternoon the tide knocked The flag down.,0
94,The man couldn't lift his son because he was so weak.,The man was so weak.,1
95,The customer walked into the bank and stabbed one of the tellers. He was immediately taken to the hospital.,The customer was immediately taken to the hospital.,0
96,Since ENTITYNAME50 was dependent on Uncle Vernon he couldn't very well marry without his approval,He couldn't very well marry without ENTITYNAME50's approval,0
97,ENTITYNAME51 came over and sat down beside Alice. Gently she stroked her hair and let the child weep.,Mama stroked her hair and let the child weep.,1
98,ENTITYNAME45 did not pass the ball to ENTITYNAME46 although she saw that she was open.,Emma saw that she was open.,1
99,ENTITYNAME27 became absorbed in Blaze the white horse. He was afraid the stable boys at the Burlington Stables struck at him and bullied him because he was timid so he took upon himself the feeding and care of the animal.,ENTITYNAME27 was afraid the stable boys at the Burlington Stables struck at him and bullied him.,1
100,By rolling over in her upper berth Tatyana could look over the edge of it and see her mother plainly. How very small and straight and rigid she lay in the bunk below! Her eyes were closed but Tatyana doubted if she slept.,Tatyana doubted if her mother slept.,1
101,ENTITYNAME53 asked Robert for a favor but he was refused.,ENTITYNAME54 was refused.,0
102,I can't cut that tree down with that axe; it is too thick.,The axe is too thick.,0
103,ENTITYNAME10 collapsed on the sidewalk. Soon he saw Carl coming to help. He was very ill.,ENTITYNAME10 was very ill.,1
104,ENTITYNAME45 did not pass the ball to ENTITYNAME46 although she saw that she was open.,ENTITYNAME46 saw that she was open.,0
105,ENTITYNAME19 gave Ralph a lift to school so he wouldn't have to drive alone.,ENTITYNAME19 wouldn't have to drive alone.,1
106,ENTITYNAME7's drawing was hung just above Tina's and it did look much better with another one below it.,ENTITYNAME7's drawing did look much better with another one below it.,1
107,Although they ran at about the same speed ENTITYNAME31 beat Sally because she had such a good start.,ENTITYNAME31 had such a good start.,1
108,ENTITYNAME55 was happy to trade me her sweater for my jacket. She thinks it looks dowdy on her.,The sweater looks dowdy on her.,1
109,ENTITYNAME10 paid for Charlie's college education. He is very grateful.,ENTITYNAME56 is very grateful.,1
110,ENTITYNAME55 was happy to trade me her sweater for my jacket. She thinks it looks great on her.,The sweater looks great on her.,0
111,Every day after dinner Mr. ENTITYNAME57 took a long nap. Mark would let him sleep for an hour then wake him up scold him and get him to work. He needed to get him to finish his work because his work was beautiful.,Mr. ENTITYNAME57's work was beautiful.,1
112,The man lifted the boy onto his shoulders.,The man lifted the boy onto the man's shoulders.,1
113,ENTITYNAME28 and Alice had very warm down coats but they were not prepared for the cold in Alaska.,coats were not prepared for the cold in Alaska.,0
114,In July Kamtchatka declared war on Yakutsk. Since Yakutsk's army was much better equipped and ten times larger they were defeated within weeks.,Yakutsk was defeated within weeks.,0
115,ENTITYNAME23 was greatly influenced by Arnold though he lived two centuries earlier.,ENTITYNAME23 lived two centuries earlier.,0
116,The path to the lake was blocked so we couldn't use it.,We couldn't use the lake.,0
117,ENTITYNAME26 borrowed the book from the library because she needs it for an article she is working on. She reads it when she gets home from work.,She reads the book when she gets home from work.,1
118,The customer walked into the bank and stabbed one of the tellers. He was immediately taken to the police station.,The teller was immediately taken to the police station.,0
119,ENTITYNAME11 can't leave work here until ENTITYNAME10 arrives to replace him. If ENTITYNAME10 had left home for work on time he would be here by this time.,ENTITYNAME10 would be here by this time.,1
120,What about the time you cut up tulip bulbs in the hamburgers because you thought they were onions?,You thought tulip bulbs were onions?,1
121,This book introduced ENTITYNAME58 to ENTITYNAME59; it was a major influence on his writing.,It was a major influence on ENTITYNAME58's writing.,1
122,ENTITYNAME43 visited Cooper's grave in 1765. At that date he had been dead for five years.,ENTITYNAME44 had been dead for five years.,1
123,ENTITYNAME28 was supposed to run the dishwasher but he put it off because he wanted to watch TV. But the show turned out to be boring so he changed his mind and turned it on.,He changed his mind and turned the TV on.,0
124,ENTITYNAME12 tried to call George on the phone but he wasn't available.,ENTITYNAME2 wasn't available.,1
125,When Tatyana reached the cabin her mother was sleeping. She was careful not to disturb her undressing and climbing back into her berth.,Tatyana was careful not to disturb her undressing and climbing back into her berth.,1
126,ENTITYNAME60 who had not told the government official that he was less than 21 when he filed for a homestead claim did not consider that he had done anything dishonest. Still anyone who knew that he was 19 years old could take his claim away from him.,Anyone who knew that he was 19 years old could take his claim away from the government official.,0
127,ENTITYNAME28 is the only man still alive who remembers my great-grandfather. He is a remarkable man.,My great-grandfather is a remarkable man.,0
128,I put the cake away in the refrigerator. It has a lot of leftovers in it.,The cake has a lot of leftovers in it.,0
129,ENTITYNAME21 signaled the barman and gestured toward his bathroom key.,ENTITYNAME21 signaled the barman and gestured toward The barman's bathroom key.,1
130,ENTITYNAME1 follows Fred's example in everything. He influences him hugely.,ENTITYNAME28 influences him hugely.,1
131,When Tatyana reached the cabin her mother was sleeping. She was careful not to disturb her  undressing and climbing back into her berth.,She was careful not to disturb her mother  undressing and climbing back into her berth.,1
132,ENTITYNAME8 gave Joan candy because she wasn't hungry.,Jane wasn't hungry.,1
133,When ENTITYNAME61 dropped his ice cream ENTITYNAME62 giggled so father gave him a stern look.,Father gave ENTITYNAME61 a stern look.,0
134,I couldn't find a spoon so I tried using a pen to stir my coffee. But that turned out to be a bad idea because it got full of ink.,The coffee got full of ink.,1
135,The man couldn't lift his son because he was so weak.,The son was so weak.,0
136,ENTITYNAME7 tried to paint a picture of shepherds with sheep but they ended up looking more like golfers.,The shepherds ended up looking more like golfers.,1
137,I couldn't find a spoon so I tried using a pen to stir my coffee. But that turned out to be a bad idea because it got full of ink.,The pen got full of ink.,0
138,ENTITYNAME0 was jogging through the park when he saw a man juggling watermelons. He was very impressed.,ENTITYNAME0 was very impressed.,1
139,ENTITYNAME28 covered his eyes with his hands because the wind was blowing sand around. He lowered them when the wind stopped.,He lowered his eyes when the wind stopped.,0
140,The delivery truck zoomed by the school bus because it was going so fast.,The school bus was going so fast.,0
141,During a game of tag ENTITYNAME63 chased Luke because he was "it".,ENTITYNAME64 was "it".,0
142,There is a gap in the wall. You can see the garden behind it.,You can see the garden through the wall.,1
143,I took the water bottle out of the backpack so that it would be lighter.,I took the water bottle out of the backpack so that the water bottle would be lighter.,0
144,The sun was covered by a thick cloud all morning but luckily by the time the picnic started it was out.,The sun was out.,1
145,ENTITYNAME21 yelled at Kevin because he was so upset.,ENTITYNAME21 was so upset.,1
146,Even before they reached town they could hear a sound like corn popping. ENTITYNAME65 asked what it was and Dad said it was firecrackers.,ENTITYNAME65 asked what the sound was.,1
147,ENTITYNAME18 passed the gameboy to John because his turn was next.,ENTITYNAME18's turn was next.,0
148,ENTITYNAME28 was supposed to run the dishwasher but he put it off because he wanted to watch TV. But the show turned out to be boring so he changed his mind and turned it on.,He changed his mind and turned the dishwasher on.,1
149,As ENTITYNAME42 carried Tommy up the long winding steps his legs ached.,ENTITYNAME61's legs ached.,0
150,The foxes are getting in at night and attacking the chickens. I shall have to kill them.,I shall have to kill The chickens.,0
151,ENTITYNAME66 looked down at the children's faces so puzzled and sad now. It was bad enough that they had to be denied so many things because he couldn't afford them.,It was bad enough that the faces had to be denied so many things because he couldn't afford them.,0
152,The sack of potatoes had been placed above the bag of flour so it had to be moved first.,The bag of flour had to be moved first.,0
153,The dog chased the cat which ran up a tree. It waited at the top.,The dog waited at the top.,0
154,ENTITYNAME1 follows Fred's example in everything. He admires him hugely.,ENTITYNAME28 admires him hugely.,0
155,The woman held the girl against her chest.,The woman held the girl against the woman's chest.,1
156,The dog chased the cat which ran up a tree. It waited at the bottom.,The dog waited at the bottom.,1
157,ENTITYNAME10 collapsed on the sidewalk. Soon he saw Carl coming to help. He was very concerned.,ENTITYNAME67 was very concerned.,1
158,ENTITYNAME7 broke both his ankles and he's walking with crutches. But a month or so from now they should be unnecessary.,The crutches should be unnecessary.,1
159,I stuck a pin through a carrot. When I pulled the pin out it left a hole.,The carrot left a hole.,0
160,ENTITYNAME7 tried to paint a picture of shepherds with sheep but they ended up looking more like dogs.,The sheep ended up looking more like dogs.,1
161,In the middle of the outdoor concert the rain started falling and it continued until 10.,The concert continued until 10.,0
162,The firemen arrived before the police because they were coming from so far away.,The firemen were coming from so far away.,0
163,I was trying to open the lock with the key but someone had filled the keyhole with chewing gum and I couldn't get it in.,I couldn't get the key in.,1
164,Of one thing ENTITYNAME27 was sure. Harry knew much less than he did.,ENTITYNAME68 knew much less than Mark did.,1
165,The Dakota prairie lay so warm and bright under the shining sun that it did not seem possible that it had ever been swept by the winds and snows of that hard winter.,It did not seem possible that the prairie had ever been swept by the winds and snows of that hard winter.,1
166,It was a summer afternoon and the dog was sitting in the middle of the lawn. After a while it got up and moved to a spot under the tree because it was hot.,The dog was hot.,1
