index,sentence1,sentence2,label
167,ENTITYNAME37 felt vindicated when his longtime rival Bill revealed that he was the winner of the competition.,ENTITYNAME37 was the winner of the competition.,1
168,ENTITYNAME69 made sure to thank Susan for all the help she had given.,ENTITYNAME69 made sure to thank ENTITYNAME9 for all the help ENTITYNAME9 had given.,1
169,They broadcast an announcement but a subway came into the station and I couldn't hear over it.,I couldn't hear the announcement.,0
170,ENTITYNAME0 was doing research in the library when he heard a man humming and whistling. He was very annoyed.,ENTITYNAME0 was very annoyed.,1
171,ENTITYNAME70 took out her flute and played one of her favorite pieces. She has loved it since she was a child.,She has loved the piece since she was a child.,1
172,I'm sure that my map will show this building; it is very good.,The map is very good.,1
173,ENTITYNAME71 believed that Rebecca regretted that she had stolen the watch.,ENTITYNAME71 believed that ENTITYNAME72 regretted that ENTITYNAME72 had stolen the watch.,1
174,The table won't fit through the doorway because it is too narrow.,The doorway is too narrow.,1
175,If the con artist has succeeded in fooling ENTITYNAME7 he would have lost a lot of money.,The con artist would have lost a lot of money.,0
176,ENTITYNAME7 pulled up a chair to the piano but it was broken so he had to sing instead.,The piano was broken so he had to sing instead.,1
177,ENTITYNAME28 is the only man alive who still remembers my father as an infant. When ENTITYNAME28 first saw my father he was twelve months old.,When ENTITYNAME28 first saw my father ENTITYNAME28 was twelve months old.,0
178,ENTITYNAME34 did a lot better than her good friend Lucy on the test because she had studied so hard.,ENTITYNAME73 had studied so hard.,0
179,ENTITYNAME8 knocked on the door and Susan answered it. She invited her to come out.,ENTITYNAME9 invited her to come out.,0
180,The path to the lake was blocked so we couldn't reach it.,We couldn't reach the lake.,1
181,ENTITYNAME55 was happy to trade me her sweater for my jacket. She thinks it looks dowdy on her.,The jacket looks dowdy on her.,0
182,ENTITYNAME74 ceded the presidency to ENTITYNAME75 because he was more popular.,ENTITYNAME74 was more popular.,0
183,I tried to paint a picture of an orchard with lemons in the lemon trees but they came out looking more like telephone poles.,The lemon trees came out looking more like telephone poles.,1
184,ENTITYNAME76 envies Martin because he is very successful.,ENTITYNAME77 is very successful.,1
185,Since it was raining I carried the newspaper in my backpack to keep it dry.,I carried the newspaper in my backpack to keep the newspaper dry.,1
186,ENTITYNAME48's parents came home and found her having sex with her boyfriend Paul. They were furious about it.,ENTITYNAME48 and Paul were furious about it.,0
187,I sat there feeling rather like a chappie I'd once read about in a book who murdered another cove and hid the body under the dining-room table and then had to be the life and soul of a dinner party with it there all the time.,He had to be the life and soul of a dinner party with the dinner party there all the time.,0
188,In the storm the tree fell down and crashed through the roof of my house. Now I have to get it removed.,Now I have to get The tree removed.,1
189,ENTITYNAME28 was supposed to run the dishwasher but he put it off because he wanted to watch TV. But the show turned out to be boring so he changed his mind and turned it off.,He changed his mind and turned the TV off.,1
190,In the middle of the outdoor concert the rain started falling and it continued until 10.,The rain continued until 10.,1
191,It is not easy to space buttonholes exactly the same distance apart and it is very difficult to cut them precisely the right size. The tiniest slip of the scissors will make the hole too large and even one thread uncut will leave it too small.,Even one thread uncut will leave one thread too small.,0
192,ENTITYNAME7 took French classes from Adam because he was known to speak it fluently.,ENTITYNAME11 was known to speak it fluently.,1
193,ENTITYNAME78 explained his theory to Mark but he couldn't convince him.,ENTITYNAME78 couldn't convince him.,1
194,Everyone really loved the oatmeal cookies; only a few people liked the chocolate chip cookies. Next time we should make more of them.,We should make more of the oatmeal cookies.,1
195,The sack of potatoes had been placed below the bag of flour so it had to be moved first.,The bag of flour had to be moved first.,1
196,As ENTITYNAME42 carried Tommy up the long winding steps his legs dangled.,ENTITYNAME61's legs dangled.,1
197,ENTITYNAME79's biography of the Spartan general ENTITYNAME80 conveys a vivid sense of the difficulties he faced in his research.,ENTITYNAME79's biography of the Spartan general ENTITYNAME80 conveys a vivid sense of the difficulties Goodman faced in his research.,1
198,ENTITYNAME27 became absorbed in Blaze the white horse. He was afraid the stable boys at the Burlington Stables struck at him and bullied him because he was timid so he took upon himself the feeding and care of the animal.,ENTITYNAME81 took upon himself the feeding and care of the animal.,0
199,ENTITYNAME13's uncle can still beat him at tennis even though he is 30 years older.,ENTITYNAME13's uncle is 30 years older.,1
200,ENTITYNAME33 was dusting the living room and trying to find the button that Mama had hidden. No time today to look at old pictures in her favorite photo album. Today she had to hunt for a button so she put the album on a chair without even opening it.,Mama had to hunt for a button.,0
201,I poured water from the bottle into the cup until it was full.,The cup was full.,1
202,During a game of tag ENTITYNAME63 chased Luke because he was "it".,ENTITYNAME63 was "it".,1
203,ENTITYNAME8 gave Joan candy because she was hungry.,Joan was hungry.,1
204,Mr. ENTITYNAME82 visited ENTITYNAME50's luxurious New York apartment thinking that it belonged to his son ENTITYNAME83. The result was that Mr. ENTITYNAME82 has decided to cancel ENTITYNAME83's allowance on the ground that he no longer requires his financial support.,ENTITYNAME83 no longer requires his financial support.,1
205,When ENTITYNAME61 dropped his ice cream ENTITYNAME62 giggled so father gave him a sympathetic look.,Father gave ENTITYNAME61 a sympathetic look.,1
206,ENTITYNAME0 was doing research in the library when he heard a man humming and whistling. He was very annoyed.,The man was very annoyed.,0
207,It is not easy to space buttonholes exactly the same distance apart and it is very difficult to cut them precisely the right size. The tiniest slip of the scissors will make the hole too large and even one thread uncut will leave it too small.,Even one thread uncut will leave the slip too small.,0
208,ENTITYNAME9 knows all about Ann's personal problems because she is nosy.,ENTITYNAME47 is nosy.,0
209,It is not easy to space buttonholes exactly the same distance apart and it is very difficult to cut them precisely the right size. The tiniest slip of the scissors will make the hole too large and even one thread uncut will leave it too small.,Even one thread uncut will leave the scissors too small.,0
210,The sun was covered by a thick cloud all morning but luckily by the time the picnic started it was out.,The cloud was out.,0
211,The journalists interviewed the stars of the new movie. They were very cooperative so the interview lasted for a long time.,The stars were very cooperative so the interview lasted for a long time.,1
212,The city councilmen refused the demonstrators a permit because they feared violence.,The city councilmen feared violence.,1
213,ENTITYNAME84 gave birth to a daughter last month. She is a very charming woman.,ENTITYNAME84's daughter is a very charming woman.,0
214,ENTITYNAME23 was greatly influenced by Arnold though he lived two centuries later.,ENTITYNAME23 lived two centuries later.,1
215,This book introduced ENTITYNAME58 to ENTITYNAME59; it was a fine selection of his writing.,It was a fine selection of ENTITYNAME58's writing.,0
216,The father carried the sleeping boy in his bassinet.,The father carried the sleeping boy in the father's bassinet.,0
217,ENTITYNAME17 took the rear seat while Bill claimed the front because his "Dibs!" was quicker.,ENTITYNAME17 took the rear seat while ENTITYNAME18 claimed the front because ENTITYNAME17's "Dibs!" was quicker.,0
218,ENTITYNAME76 envies Martin although he is very successful.,ENTITYNAME77 is very successful.,0
219,Of one thing ENTITYNAME27 was sure. Harry knew much less than he did.,ENTITYNAME68 knew much less than ENTITYNAME68 did.,0
220,Since ENTITYNAME50 was dependent on Uncle Vernon he couldn't very well marry without his approval,Uncle ENTITYNAME85 couldn't very well marry without his approval,0
221,ENTITYNAME43 visited Cooper's grave in 1765. At that date he had been dead for five years.,ENTITYNAME43 had been dead for five years.,0
222,ENTITYNAME27 told ENTITYNAME76 many lies about himself which ENTITYNAME76 included in his book. He should have been more skeptical.,ENTITYNAME27 should have been more skeptical.,0
223,My meeting started at 4:00 and I needed to catch the train at 4:30 so there wasn't much time. Luckily it was delayed so it worked out.,The meeting was delayed so it worked out.,0
224,The foxes are getting in at night and attacking the chickens. They have gotten very nervous.,The foxes have gotten very nervous.,0
225,I put the butterfly wing on the table and it broke.,The butterfly wing broke.,1
226,ENTITYNAME28 and Alice had very warm down coats but they were not prepared for the cold in Alaska.,ENTITYNAME28 and Alice were not prepared for the cold in Alaska.,1
227,ENTITYNAME19 gave Ralph a lift to school so he wouldn't have to walk.,ENTITYNAME19 wouldn't have to walk.,0
228,I put the cake away in the refrigerator. It has a lot of leftovers in it.,The refrigerator has a lot of leftovers in it.,1
229,ENTITYNAME78 explained his theory to Mark but he couldn't convince him.,ENTITYNAME27 couldn't convince him.,0
230,I took the water bottle out of the backpack so that it would be handy.,I took the water bottle out of the backpack so that the water bottle would be handy.,1
231,The fish ate the worm. It was tasty.,The worm was tasty.,1
232,As ENTITYNAME86 in the crop duster passed over Susan she could see the landing strip.,ENTITYNAME86 could see the landing strip.,1
233,As ENTITYNAME86 in the crop duster passed over Susan she could see the landing strip.,Susan could see the landing strip.,0
234,ENTITYNAME4 is holding captive a scientist Dr. ENTITYNAME5 who has invented a device that turns animals invisible; ENTITYNAME4 plans to use it on Geoffrey and send him to steal nuclear material from an army vault.,ENTITYNAME4 plans to use it on ENTITYNAME6 and send ENTITYNAME6 to steal nuclear material from an army vault.,1
235,ENTITYNAME74 ceded the presidency to ENTITYNAME75 because he was more popular.,ENTITYNAME75 was more popular.,1
236,ENTITYNAME60 who had not told the government official that he was less than 21 when he filed for a homestead claim did not consider that he had done anything dishonest. Still anyone who knew that he was 19 years old could take his claim away from him.,The government official was less than 21 when he filed for a homestead claim.,0
237,ENTITYNAME51 came over and sat down beside Alice. Gently she stroked her hair and let the child weep.,ENTITYNAME33 stroked her hair and let the child weep.,0
238,ENTITYNAME33 looked for her friend ENTITYNAME87 in the crowd. Since she always has good luck ENTITYNAME33 spotted her quickly.,Since ENTITYNAME87 always has good luck Alice spotted her quickly.,0
239,I sat there feeling rather like a chappie I'd once read about in a book who murdered another cove and hid the body under the dining-room table and then had to be the life and soul of a dinner party with it there all the time.,He had to be the life and soul of a dinner party with the body there all the time.,1
240,The cat was lying by the mouse hole waiting for the mouse but it was too impatient.,The mouse was too impatient.,0
241,Everyone really loved the oatmeal cookies; only a few people liked the chocolate chip cookies. Next time we should make more of them.,We should make more of the chocolate chip cookies.,0
242,ENTITYNAME21 signaled the barman and gestured toward his bathroom key.,ENTITYNAME21 signaled the barman and gestured toward ENTITYNAME21's bathroom key.,0
243,ENTITYNAME27 was close to Mr. Singer's heels. He heard him calling for the captain promising him in the jargon everyone talked that night that not one thing should be damaged on the ship except only the ammunition but the captain and all his crew had best stay in the cabin until the work was over.,He heard Mr. ENTITYNAME35 calling for the captain.,1
244,I couldn't put the pot on the shelf because it was too tall.,The shelf was too tall.,0
245,ENTITYNAME0 was jogging through the park when he saw a man juggling watermelons. He was very impressive.,The juggler was very impressive.,1
246,The lawyer asked the witness a question but he was reluctant to answer it.,The witness was reluctant to answer it.,1
247,ENTITYNAME9 knew that Ann's son had been in a car accident because she told her about it.,ENTITYNAME9 told her about it.,0
248,Since ENTITYNAME50 was dependent on Uncle Vernon he couldn't very well marry without his approval,ENTITYNAME50 couldn't very well marry without his approval,1
249,When the sponsors of the bill got to the town hall they were surprised to find that the room was full of opponents. They were very much in the majority.,The opponents were very much in the majority.,1
250,ENTITYNAME40 cried because Toby wouldn't share his toy.,ENTITYNAME40 cried because ENTITYNAME41 wouldn't share ENTITYNAME41's toy.,1
251,At the Loebner competition the judges couldn't figure out which respondents were the chatbots because they were so stupid.,The judges were so stupid.,1
252,The large ball crashed right through the table because it was made of steel.,The table was made of steel.,0
253,ENTITYNAME14 worked hard to harvest his beans so he and his family would have enough to eat that winter His friend ENTITYNAME15 let him stack them in his barn where they would dry. Later he and ENTITYNAME16 would shell them and cook them for their Sunday dinners.,His friend ENTITYNAME15 let him stack the beans in his barn where they would dry.,1
254,ENTITYNAME8 knocked on Susan's door but there was no answer. She was out.,ENTITYNAME8 was out.,0
255,ENTITYNAME8 knocked on the door and Susan answered it. She invited her to come in.,ENTITYNAME8 invited her to come in.,0
256,The table won't fit through the doorway because it is too wide.,The doorway is too wide.,0
257,A number of times ENTITYNAME15 had been present at interviews which his father had had with noted detectives who desired his aid in solving perplexing mysteries and those occasions stood out as red-letter days for him.,Those occasions stood out as red-letter days for father.,0
258,If the con artist has succeeded in fooling ENTITYNAME7 he would have lost a lot of money.,ENTITYNAME7 would have lost a lot of money.,1
259,ENTITYNAME3 a timid teen-ager lives with his widowed mother in a Brooklyn housing project. ENTITYNAME3's father a gang leader was shot to death; his father's disciple ENTITYNAME88 takes ENTITYNAME3 under his wing and quickly molds him into a drug runner.,His father's disciple ENTITYNAME88 takes ENTITYNAME3 under his wing and quickly molds ENTITYNAME3's father into a drug runner.,0
260,ENTITYNAME37 felt crushed when his longtime rival Bill revealed that he was the winner of the competition.,ENTITYNAME37 was the winner of the competition.,0
261,ENTITYNAME28 covered his eyes with his hands because the wind was blowing sand around. He lowered them when the wind stopped.,He lowered his hands when the wind stopped.,1
262,The Wainwrights treated Mr. ENTITYNAME89 like a prince until he made his will in their favor; then they treated him like dirt. Folks said he died just to be rid of their everlasting nagging.,Folks said he died just to be ride of the folks' everlasting nagging.,0
263,The father carried the sleeping boy in his arms.,The father carried the sleeping boy in the boy's arms.,0
264,There is a gap in the wall. You can see the garden through it.,You can see the garden through the wall.,0
265,Archaeologists have concluded that humans lived in Laputa 20000 years ago. They hunted for deer on the river banks.,Archaeologists hunted for deer on the river banks.,0
266,ENTITYNAME9 knew that Ann's son had been in a car accident so she told her about it.,ENTITYNAME9 told her about it.,1
267,Then Dad figured out how much the man owed the store; to that he added the man's board-bill at the cook-shanty. He subtracted that amount from the man's wages and made out his check,The man subtracted that amount from the man's wages.,0
268,The customer walked into the bank and stabbed one of the tellers. He was immediately taken to the hospital.,The teller was immediately taken to the hospital.,1
269,ENTITYNAME74 ceded the presidency to ENTITYNAME75 because he was less popular.,ENTITYNAME74 was less popular.,1
270,ENTITYNAME0 hired Bill to take care of him.,ENTITYNAME0 hired ENTITYNAME18 to take care of ENTITYNAME18.,0
271,ENTITYNAME18 passed the gameboy to John because his turn was next.,ENTITYNAME0's turn was next.,1
272,ENTITYNAME13 paid the detective after he delivered the final report on the case.,ENTITYNAME13 delivered the final report on the case.,0
273,ENTITYNAME28 is the only man alive who still remembers my father as an infant. When ENTITYNAME28 first saw my father he was twelve months old.,When ENTITYNAME28 first saw my father My father was twelve months old.,1
274,ENTITYNAME53 asked Robert for a favor but he was refused.,ENTITYNAME53 was refused.,1
275,ENTITYNAME29 spoke to Donna breaking her silence.,ENTITYNAME29 spoke to ENTITYNAME30 breaking ENTITYNAME29's silence.,1
276,ENTITYNAME10 was playing cards with ENTITYNAME11 and was way ahead. If ENTITYNAME11 hadn't had a sudden run of good luck he would have lost.,ENTITYNAME10 would have lost.,0
277,ENTITYNAME17 had to stop Bill from toying with the injured bird. He is very cruel.,ENTITYNAME17 is very cruel.,0
278,ENTITYNAME47 asked Mary what time the library closes but she had forgotten.,Mary had forgotten.,1
279,The sculpture rolled off the shelf because it wasn't anchored.,The sculpture wasn't anchored.,1
280,ENTITYNAME71 believed that Rebecca suspected that she had stolen the watch.,ENTITYNAME71 believed that ENTITYNAME72 suspected that ENTITYNAME71 had stolen the watch.,1
281,ENTITYNAME12 tried to call George on the phone but he wasn't successful.,ENTITYNAME2 wasn't successful.,0
282,ENTITYNAME70 tucked her daughter Anne into bed so that she could work.,ENTITYNAME70 tucked her daughter ENTITYNAME84 into bed so that ENTITYNAME70 could work.,1
283,ENTITYNAME53 asked Robert for a favor but he refused.,ENTITYNAME54 refused.,1
284,I couldn't find a spoon so I tried using a pen to stir my coffee. But that turned out to be a bad idea because it got full of coffee.,The coffee got full of coffee.,0
285,The path to the lake was blocked so we couldn't use it.,We couldn't use the path.,1
286,Stretching her back the woman smiled at the girl.,Stretching the girl's back the woman smiled at the girl.,0
287,Archaeologists have concluded that humans lived in Laputa 20000 years ago. They hunted for evidence on the river banks.,Archaeologists hunted for evidence on the river banks.,1
288,I tried to paint a picture of an orchard with lemons in the lemon trees but they came out looking more like light bulbs.,The lemons came out looking more like light bulbs.,1
289,This morning ENTITYNAME49 built a sand castle on the beach and put a toy flag in the highest tower but this afternoon the tide knocked it down.,This afternoon the tide knocked The sand castle down.,1
290,The foxes are getting in at night and attacking the chickens. They have gotten very nervous.,The chickens have gotten very nervous.,1
291,ENTITYNAME19 threw his schoolbag down to Ray after he reached the top of the stairs.,ENTITYNAME90 reached the top of the stairs.,0
292,In July Kamtchatka declared war on Yakutsk. Since Yakutsk's army was much better equipped and ten times larger they were defeated within weeks.,Kamchatka was defeated within weeks.,1
293,ENTITYNAME32 fired her trainer because she slept with her boyfriend.,The trainer slept with her boyfriend.,1
294,ENTITYNAME17 had to stop Bill from toying with the injured bird. He is very compassionate.,ENTITYNAME17 is very compassionate.,1
295,I used an old rag to clean the knife and then I put it in the trash.,I put the rag in the trash.,1
296,Patting her back the woman smiled at the girl.,Patting the woman's back the woman smiled at the girl.,0
297,The large ball crashed right through the table because it was made of styrofoam.,The table was made of styrofoam.,1
298,I was trying to open the lock with the key but someone had filled the keyhole with chewing gum and I couldn't get it out.,I couldn't get the chewing gum out.,1
299,ENTITYNAME11 can't leave work here until ENTITYNAME10 arrives to replace him. If ENTITYNAME10 had left home for work on time he would be gone by this time.,ENTITYNAME11 would be gone by this time.,1
300,ENTITYNAME10 paid for ENTITYNAME56's college education but now ENTITYNAME56 acts as though it never happened. He is very hurt.,ENTITYNAME10 is very hurt.,1
301,ENTITYNAME60 who had not told the government official that he was less than 21 when he filed for a homestead claim did not consider that he had done anything dishonest. Still anyone who knew that he was 19 years old could take his claim away from him.,Anyone who knew that he was 19 years old could take his claim away from ENTITYNAME60.,1
302,ENTITYNAME70 took out her flute and played one of her favorite pieces. She has had it since she was a child.,She has had the flute since she was a child.,1
303,ENTITYNAME7 and ENTITYNAME25 are passionately in love but ENTITYNAME25's parents are unhappy about it because they are snobs.,ENTITYNAME7 and Amy are snobs.,0
304,This book introduced ENTITYNAME58 to Goethe; it was a fine selection of his writing.,It was a fine selection of ENTITYNAME58's writing.,1
305,The foxes are getting in at night and attacking the chickens. I shall have to guard them.,I shall have to guard The chickens.,1
306,The donkey wished a wart on its hind leg would disappear and it did.,The donkey wished a wart on its hind leg would disappear and wart did.,1
307,I put the cake away in the refrigerator. It has a lot of butter in it.,The refrigerator has a lot of butter in it.,0
308,The sack of potatoes had been placed below the bag of flour so it had to be moved first.,The sack of potatoes had to be moved first.,0
309,ENTITYNAME66 looked down at the children's faces so puzzled and sad now. It was bad enough that they had to be denied so many things because he couldn't afford them.,He couldn't afford the faces.,0
310,I put the heavy book on the table and it broke.,The heavy book broke.,0
311,I used an old rag to clean the knife and then I put it in the drawer.,I put the knife in the drawer.,1
312,ENTITYNAME53 asked Robert for a favor but he refused.,ENTITYNAME53 refused.,0
313,Men had the right to keep their sons working for them until they were 21 years of age.,Men had the right to keep their sons working for them until the sons were 21 years of age.,1
314,The older students were bullying the younger ones so we rescued them.,We rescued the younger students.,1
315,This morning ENTITYNAME49 built a sand castle on the beach and put a toy flag in the highest tower but this afternoon the wind knocked it down.,This afternoon the wind knocked The flag down.,1
316,The sack of potatoes had been placed above the bag of flour so it had to be moved first.,The sack of potatoes had to be moved first.,1
317,ENTITYNAME84 gave birth to a daughter last month. She is a very charming baby.,ENTITYNAME84's daughter is a very charming baby.,1
318,Tatyana managed two guitars and a bag and still could point out the Freemans: "Isn't it nice that they have come Mama!",Isn't it nice that the ENTITYNAME91s have come Mama!",1
319,The painting in ENTITYNAME27's living room shows an oak tree. It is to the right of the bookcase.,The painting is to the right of the bookcase.,1
320,ENTITYNAME27 was close to Mr. Singer's heels. He heard him calling for the captain promising him in the jargon everyone talked that night that not one thing should be damaged on the ship except only the ammunition but the captain and all his crew had best stay in the cabin until the work was over.,The captain and all ENTITYNAME27's crew had best stay in the cabin until the work was over.,0
321,When Tatyana reached the cabin her mother was sleeping. She was careful not to disturb her undressing and climbing back into her berth.,She was careful not to disturb her undressing and climbing back into her mother's berth.,0
322,ENTITYNAME27 heard Steve's feet going down the ladder. The door of the shop closed after him. He ran to look out the window.,ENTITYNAME1 ran to look out the window.,0
323,The storekeepers stayed in town to run their stores and lived in the rooms behind them.,The storekeepers stayed in town to run their stores and lived in the rooms behind the storekeepers.,0
324,ENTITYNAME76 envies Martin because he is very successful.,ENTITYNAME76 is very successful.,0
